authors,date_downloaded,date_modified,date_published,date_submitted,image_url,incident_date,incident_id,language,mongodb_id,source_domain,submitters,text,title,url
"[""The Guardian""]",2021-08-26,2021-08-26,2020-11-21,2021-08-26,https://i.guim.co.uk/img/media/0ff69d2cdc1f8298e4d7e52bc3f9eadb90a805b5/189_128_3354_2012/master/3354.jpg?width=700&quality=45&auto=format&fit=max&dpr=2&s=d3f75450c6d9aa02d7491afeb6e87f91,2017-01-04,57,en,,www.theguardian.com,"[""Anonymous""]","'Robodebt-related trauma': the victims still paying for Australia's unlawful welfare crackdown
Nathan Kearney says he lost two and half years of his life to robodebt. He’s still seeing a counsellor about it.

Four years ago he was living in Brisbane, seeing and playing gigs, working several different casual jobs and generally enjoying his 20s.

Then the debts came, first for about $2,000, and a year later for $4,500. It was the same story: you have underreported your income, you owe us this much money, please provide us your old payslips. He couldn’t.

Overwhelmed by the idea he now owed the government more than $6,000, Kearney moved back in with his parents in East Gippsland.

I wanted to know why those ministers felt that it was appropriate to use this illegal system and to target the most vulnerable
He was 27, dreams on hold, while he worked 50 hours a week in a country town he didn’t like just to regain a sense of financial stability.

“I feel like I got put back a couple of years in life because of this,” Kearney says. “And I would be closer to where I want to be at 31 years old if it hadn’t been for robodebt.”

On Monday the government reached a settlement with Gordon Legal, a law firm running a class action on behalf of hundreds of thousands of people caught up in the Coalition’s government welfare debt recovery program.

The settlement was for an eye-watering $1.2bn but almost all of the money came from the government’s May announcement to repay and wipe debts raised using the unlawful “income-averaging” of ATO pay data.

In fact, the only new figure was $111m in compensation that will be shared between about 430,000 victims.

The sums will vary significantly, depending on how much debt people had paid and how long they’d been without their money. Legal costs, which will be deducted from the compensation, are yet to be determined.

Many people have flooded victims’ group Facebook pages, as well as Gordon Legal’s own page, to express frustration at the compensation figure, which they feel does not reflect the pain or suffering the four-year program caused.

Moreover, some are angry that a scandal they see as being punctuated by continual cover-up and obfuscation never made it to a courtroom.

“I wanted to know why those ministers felt that it was appropriate to use this illegal system and to target the most vulnerable people,” Kearney says. “I wanted somebody to ask them to their faces: ‘Why did you think that it was OK to take money from the poorest people without giving them a chance to argue their case?’”

Others, like Jennifer Miller, whose son Rhys Cauzzo took his life when he was 28, say they intend to object to the settlement, which will need to be approved by the court. “There has been no accountability whatsoever,” Miller says.

Cauzzo lived with depression and anxiety but Miller believes the financial pressure that came from two Centrelink debts tipped him over the edge on Australia Day 2017.

Along with Kath Madgwick, whose son also took his life after receiving a Centrelink debt, Miller has been campaigning against the robodebt scheme for three years.

Like Kearney, she is insistent the case should have gone to court. “This isn’t over,” she says.

Gordon Legal emphasised this week that the settlement – an “excellent outcome” for clients and group members – should be viewed in its full context.

The robodebt settlement leaves many victims out in the cold once again
Read more
“When you think about the totality of what’s been achieved since the proceedings were commenced, that really amounts to more than $1.2bn,” said a partner at the law firm, Andrew Grech.

It was the Amato case brought by Victoria Legal Aid that established the legal precedent that ruled that robodebt’s “income averaging” unlawful.

But in the months afterwards, the government simply stonewalled. It said nothing about refunds and claimed only a “small cohort” of people had been affected.

Indeed, the refund decision in May, which Guardian Australia revealed two months earlier, was prompted by the need for a strategy to respond to the Gordon Legal class action.

In the lead-up to Monday’s announcement, it was clear that a settlement was looking likely.

And the $111m figure was said, from the government’s perspective, to represent the interest owed, rather than compensation for stress or anguish.

The government services minister, Stuart Robert, later publicly confirmed the government’s view of the compensation, noting it was for “the most part, for interest payments for money held”.

The commonwealth “has not accepted or admitted any liability in the matter”, Robert noted.

Robodebt: this is my list of who should be held to account
First Dog on the Moon
First Dog on the Moon
Read more
Though victims longed for their day in court, the two-week trial promised to be a fairly dry affair based mostly on documentary evidence and legal arguments.

The government did not plan to call any witnesses, so there was little prospect the former human services minister, Alan Tudge, or top departmental officials would need to take the stand.

In addition, the government’s prospects advice from earlier in the year said while it was likely a court would order refunds, plus interest, Gordon Legal’s negligence claim was unlikely to succeed.

Still, for some victims, the government’s lawyers would have been there in the “virtual” courtroom, defending their case.

Gordon Legal’s statement of claim, for example, alleged Centrelink was well aware of the distress the program had caused victims.

Nathan Kearney outside his home
Kearney outside his home in Brisbane. Photograph: David Kelly/The Guardian
Kearney says it was the second debt that caused his mental health to plummet (he lives with chronic depression). He also fell out with some friends, though he notes they’ve since patched things up.

Because he continued to contest his debts, Centrelink eventually sent them off to a private debt collector who would call him three times a day.

Centrelink also garnisheed nearly $3,000 from his tax return.

“Once they [the debt collectors] started calling, they … put you into a certain headspace, which is like a shame and guilt spiral,” he says. “Whether or not you deserve to feel the shame or guilt, it’s still there within me.

“Sometimes they’d call and I’d tell them, like, ‘I can’t deal with this any more. I’ve been thinking about taking my life,’ and things like that. It didn’t change anything.”

Perhaps as many as 100,000 people were also left out of the refunds because they provided payslips or bank statements after being hit with an initially unlawful debt. It was then recalculated and a debt was substantiated.

And Gordon Legal, which had initially argued these debts were “tainted”, dropped that claim in the settlement.

Centrelink office sign
More welfare debts under scrutiny after tribunal rulings cast doubt on Services Australia methods
Read more
Some of those people expressed anger and confusion at that outcome in conversations with Guardian Australia this week.

Other refund recipients, like the man who told the Guardian his debt had been a factor in his marriage breakdown, may only get the sense of justice they seek from a royal commission, as proposed by Labor and the Greens.

“I’ve been seeing somebody to actively to talk through, I guess, ‘robodebt-related trauma’ is the way that they put it, and slowly coming to terms with it,” says Kearney, who is now back in Brisbane.

He used to fear another debt might arrive at any moment.

“Now, with the settlement, it does feel like, ‘Everything’s gone back to normal, they’ve made penance … and everything goes good again,’” he says. “Whereas I think a lot of us are still dealing with the impacts of what they did years ago, even if we got our refunds.”
",'Robodebt-related trauma': the victims still paying for Australia's unlawful welfare crackdown,https://www.theguardian.com/australia-news/2020/nov/21/robodebt-related-trauma-the-victims-still-paying-for-australias-unlawful-welfare-crackdown
"[""Thomas Claburn""]",2021-09-16,2021-09-16,2021-08-20,2021-09-16,"{ ""$undefined"": true }",2020,0,en,,www.theregister.com,"[""Roman Lutz""]","A committee at the University of Texas in Austin has advised against using AI software to oversee students' online tests, citing the psychological toll on students and the financial toll on academic institutions.

Acknowledging that some form of online proctoring is necessary to discourage academic misconduct, the committee concluded, ""we strongly recommend against the use of AI-based software like Proctorio and ProctorU.""

The Report of the Academic Integrity Committee about Online Testing and Assessment, spotted by Megan Menchaca, education reporter for the Austin-American Statesman, is said to have been included in a university official's recent message to faculty.

AI-based software to watch over remote students as they take online tests – ""academic surveillance software"" to detractors – has flourished during the COVID-19 pandemic. Large numbers of students have been studying remotely and schools believe they need a way to prevent cheating.

But the software that's been deployed has been widely criticized by students and privacy advocates. The concern centers around the inability to audit the software source code and the possibility that these systems rely on flawed algorithms and biased or arbitrary signals to label students cheaters.

Critics also worry that the software can't account for varied student living conditions and is vulnerable to racial bias – eg, motion tracking that produces different results with different skin tones – and cognitive bias such as gaze tracking that flags ADHD behaviors as suspicious.

Such criticism last year led UC Berkeley [PDF] and Baruch College in New York to stop using remote proctoring products. In February, the University of Illinois at Urbana-Champaign said it will drop Proctorio after this summer due to ""significant accessibility concerns.""
When in doubt, sue

Amid this backlash, proctoring software maker Proctorio sued critics, alleging last year that Ian Linkletter, a learning technology specialist at the University of British Columbia (UBC) in Vancouver, Canada, violated US copyright law by linking to the company's publicly viewable videos. That case remains ongoing in Canada, and has forced Linkletter to appeal for funds to defend himself through the costly legal process.

Proctorio also last year filed a Digital Millennium Copyright Act (DMCA) takedown complaint against Miami University computer science student Erik Johnson seeking the removal of posts on Twitter that were critical of the company. Twitter removed the posts and later restored them.

The firm's legal crusade prompted pushback from the Electronic Frontier Foundation, which said the company should not be able ""to abuse copyright law to undermine their critics.""

    Uni revealed it killed off its PhD-applicant screening AI – just as its inventors gave a lecture about the tech
    'Meritless': Exam software maker under fire for suing teacher who tweeted links to biz's unlisted YouTube vids
    Twitter uses HackerOne bounties to find biases in its image-cropping AI model
    Zoom incompatible with GDPR, claims data protection watchdog for the German city of Hamburg

The UT Austin committee began working on its report after student councils in the spring of 2021 asked the university to get rid of AI proctoring software, which was used widely during the 2020-2021 academic year.

The committee asked student leaders and faculty to provide information about how the software was employed and decided that it just wasn't worth it.

""The invasive nature of the tools as well as the warnings that the tools may send to the screen during the exam cause high levels of anxiety,"" the report says.

""Although these tools were used extensively by faculty in academic year 2020-2021, only 27 cases were referred to the Student Conduct and Academic Integrity office as potential violations of academic integrity, and of these only 13 were upheld. Thus, the psychological (and financial) costs of the tool do not seem to be worth the small benefit of using it.""
Trust the teachers

The report goes on to suggest alternative methods of watching over students during tests, such as Zoom for small groups, and other academic software like Canvas Quizzes, Gradescope, and Panopto. It also recommends that instructors consider rethinking how they assess student progress in order to reduce online test anxiety.

The University of Texas at Austin, Proctorio, and ProctorU did not respond to requests for comment.

In an email to The Register, Linkletter – still awaiting a ruling on his effort to dismiss Proctorio's copyright complaint under Canada's anti-SLAPP statute, the Protection of Public Participation Act – said what stands out to him from the UT Austin report is the finding that Proctorio just isn't worth it.

""Every institution should be taking a hard look at whether Proctorio is worth the 'psychological cost' mentioned in the report, let alone the expense,"" he said.

""Over half of the 27 students accused had their academic integrity cases tossed. Thousands of students were surveilled, at great expense, for what? How much faculty and staff time was wasted? How much unnecessary heartbreak caused?

""Students understand that surveillance is wrong. They know how the technology works. There is no technical explanation that will reduce the harm being done – it simply needs to stop.

""The only way institutions can demonstrate they are listening to students is to stop using academic surveillance software."" ®
Updated to add

In a statement emailed to The Register Jarrod Morgan, Chief Strategy Officer of Meazure Learning, the parent company of ProctorU, took issue with the UT report and said that his firm gave up on AI proctoring several months ago.

“After our decision and announcement earlier this year to discontinue all Al-only exam monitoring, every single exam from every single test-taker using ProctorU is reviewed by a trained, live proctor,” said Morgan.

“As ProctorU announced at the time, it’s only proctoring if a human does it and, more importantly, it’s the only way to be sure the process is accurate, fair and consistent. Some exam monitoring companies may rely on AI software to monitor exams and score students, ProctorU is not one of them and it is important to understand the differences between true proctoring with a trained live proctor and the less-expensive and in our opinion, unacceptable option of ‘monitoring’ software such as that offered by Proctorio.”","Using 'AI-based software like Proctorio and ProctorU' to monitor online exams is a really bad idea, says uni panel",https://www.theregister.com/2021/08/20/ai_proctoring_software/
"[""Andy Brown""]",2021-10-02,2021-10-02,2021-08-09,2021-10-02,https://www.nme.com/wp-content/uploads/2021/07/steam-deck-library.jpg,2021-08-03,0,en,,www.nme.com,"[""Kate Perkins""]","150 people have been fired from Xsolla – a game payment company used by Steam, the Epic Games Store and other game developers – via a controversial email from CEO and founder Aleksandr Agapitov.

Agapitov contacted 150 fired employees through email on August 3, stating that “my big data team analyzed your activities” and accused them of being “unengaged and unproductive employees”.

The email starts by saying:

“You received this email because my big data team analyzed your activities in Jira, Confluence, Gmail, chats, documents, dashboards and tagged you as unengaged and unproductive employees. In other words, you were not always present at the workplace when you worked remotely.”

Agapitov also states, “Many of you might be shocked, but I truly believe that Xsolla is not for you” and that employees would receive help through separate HR companies. The email ends by listing the names of everyone who has been fired, and says “If you want to stay in contact with me, please write me a long letter about all your observations, injustice, and gratitude”.

All of the fired employees were based in Xsolla’s office in Perm, Russia. In a follow-up press conference reported by App2Top, Agapitov claimed that the layoffs were due to the company no longer showing 40 per cent growth.

After the press conference, Agapitov posted a Tweet which Game World Observer reports as translating to “Work your fucking ass off or get your fucking ass out”.

Xsolla has been accused of spying on employees to gather the metrics they were judged on – HR expert Alyona Vladimirskaya has argued that monitoring productivity like this is “extremely ineffective” and encourages fired employees to sue.

Xsolla provides payment services for large companies in the games industry, including Valve, Twitch, Epic Games and Ubisoft.

In other news, Darksiders III is coming to the Nintendo Switch next month.",Game payment company Xsolla fires 150 employees via controversial email,https://www.nme.com/news/gaming-news/game-payment-company-xsolla-fires-150-employees-via-controversial-email-3014850
"[""Sam Desatoff""]",2021-10-02,2021-10-02,2021-08-09,2021-10-02,https://deifoexkvnt11.cloudfront.net/assets/article/2021/08/09/xsolla-horizontal_feature.jpg,2021-08-03,0,en,,gamedaily.biz,"[""Kate Perkins""]","The news raises a number of ethical questions that are especially pertinent in a pandemic-stricken working environment.

Xsolla, the Russia-based games industry payment solution provider, has reportedly laid off upwards of 150 employees following a productivity audit of the company. Originally reported by Game World Observer, the layoffs were a result of an AI-based big data analysis of Xsolla. According to the Observer’s report, the magnitude of the layoffs--which mostly affected employees in company’s Perm offices--was determined after an examination of workers’ productivity across various workspace software, including Gmail, Jira, and Confluence, in addition to others.

Although unfortunate--especially considering the ongoing COVID-19 pandemic--the layoffs themselves aren’t the ultimate controversy here. Rather, it’s the way Xsolla CEO Aleksandr Agapitov handled the situation. In a company email, which has been translated from Russian, Agapitov used language that could be flippant and insulting. In particular, he specifically labeled fired employees as “unengaged and unproductive,” stating that “I truly believe Xsolla isn not for you.”

Following the email last week, Agapitov took to Twitter and posted a statement that roughly equates to “get the fuck in, or get the fuck out,” according to various translations.

Further complicating the situation is the fact that many of the employees appear to have been unaware that their activities were being tracked by Xsolla’s data collection AI. It’s a personal breach that Renee Gittins, executive director of the International Game Developers Association (IGDA), calls frightening and unethical.

“Layoffs are not uncommon, particularly in a turbulent industry like games,” Gittins told GameDaily. “Choosing who to let go of and how to communicate downsizing can be a difficult task. Unfortunately, Agapitov's termination emails and surrounding commentary lacked empathy and respect for those whose lives have been affected. Terminating such a large amount of people based on activity in software that they were not aware was being tracked is not only concerning from a business perspective but also a cultural and ethical one.”

Gittins said that evaluating a worker’s productivity based on software interaction and without their knowledge is deeply inappropriate and morally wrong. The nature of creative work, she explained, is impossible for AI software to track, and professionals in such a field will often approach their jobs in unique and unconventional ways.

“Such an evaluation could harm those with nonstandard approaches and with different neurodiversities, even if their overall output matches their peers. Tracking such values and then terminating people based on them is sure to create distrust and anxiety within the culture of Xsolla's workforce.”

In this way, Gittins expects Agapitov and Xsolla’s actions to perpetuate distrust, resulting in even more of the undesired behavior that the company cited in the first place, a cycle that is likely to sow low morality among the workforce. Further, the fact that AI software was used to make such rash decisions could speak to a greater problem of disorganization and inefficiency within Xsolla as a whole.

“It is common business sense to only measure and promote KPIs that are of direct benefit to the business behaviors you desire,” Gittins said. “People are very likely to behave in a way to maximize those values even if those values do not result in business returns and profits. It would not surprise me if Xsolla sees tickets for tasks too small to warrant them, drafts in Google Documents that would be more efficiently created on paper or whiteboards, and other behaviors to keep up these tracked metrics that may overall hurt productivity.”

In the fallout of the layoffs, some are sure to question what legal recourse, if any, former Xsolla employees might have. The answer is largely dependent on a number of variables, including evidence gathered by those affected, Russian employment law, and other stipulations. These are all outside the purview of attorney Richard Hoeg, who practices in Michigan, USA, but there is some conjecture that can still be made in this situation.

“The biggest issue I can see here from afar could possibly be data collection and privacy,” Hoeg told GameDaily. “In general, employers have the right to ensure productivity (certainly on their own equipment), but it's possible that trying to maintain that control on private computers (with whatever scans/analysis is necessary) could trip some data rules. They also would likely have had to make sure the employees/contractors knew that’s what they were doing.”

Hoeg’s speculation is predicated on the fact that much of the games industry shifted to remote work at the onset of the pandemic. As such, many workers are utilizing their own computers and hardware to perform work duties, raising even more ethical questions regarding Xsolla’s use of data collection software.

It’s unquestionably a gray area, and Agapitov himself noted that much of the layoffs affected employees working remotely:

“In other words, you were not always present at the workplace when you worked remotely,” he wrote in the email.

In all, the layoffs paint a grim picture of how Agapitov values his employees. The pandemic has not been easy for anybody, but it appears that Xsolla expected work to continue as normal. Using AI-based tracking software raises a host of ethical concerns, and perhaps Agapitov needs to address such questions publicly.",Xsolla fires 150 employees following AI-based productivity audit,https://gamedaily.biz/article/2127/xsolla-fires-150-employees-following-ai-based-productivity-audit
