authors,date_downloaded,date_modified,date_published,date_submitted,image_url,incident_date,incident_id,language,mongodb_id,source_domain,submitters,text,title,url
"[""Kathleen McGrory""]",2021-07-27,2021-07-27,2021-01-24,2021-07-27,https://www.tampabay.com/resizer//cO_17RyGWDwiA_U0WKWSma-psp8=/1140x641/smart/cloudfront-us-east-1.images.arcpublishing.com/tbt/DB4D5UWIKAI6TGNIIBWI6S7HAY.jpg,2015-09-01,0,en,,www.tampabay.com,"[""Kate Perkins""]","Critics of the agency’s intelligence programs called the letter ‘patronizing’ and ‘offensive,’ and raised continued concerns about civil rights

It starts like an offer of admission from a prestigious university.

“We are pleased to inform you that you have been selected…” it says.

But the four-page letter from the Pasco Sheriff’s Office goes on to tell recipients they will be facing enhanced police scrutiny under the agency’s controversial intelligence program.

“You may wonder why you were enrolled in this program,” the letter continues. “You were selected as a result of an evaluation of your recent criminal behavior using an unbiased, evidence-based risk assessment designed to identify prolific offenders in our community. As a result of this designation, we will go to great efforts to encourage change in your life through enhanced support and increased accountability.”

Last year, a Tampa Bay Times investigation revealed that the Sheriff’s Office creates lists of people it considers likely to break the law based on criminal histories, social networks and other unspecified intelligence. The agency sends deputies to their homes repeatedly, often without a search warrant or probable cause for an arrest.

Targets and their relatives, including four who are now suing the Sheriff’s Office in federal court, described the tactics as harassment and a violation of their constitutional rights. National policing experts drew comparisons to child abuse and surveillance that could be expected under an authoritarian regime.

The Times also found that the agency has a separate program that uses schoolchildren’s grades, attendance records and abuse histories to label them potential future criminals.

Earlier this year, Sheriff Chris Nocco and the Pasco County school district announced they would scale back some features of the school-data program. But the letter signals a broadening of the core program.

The Sheriff’s Office said the letter is part of a new intelligence effort aimed specifically at people whose criminal histories include drug offenses and violent crimes.

It was supposed to launch in mid-2020, but was delayed until December because of the pandemic, Sheriff’s Office spokeswoman Amanda Hunter said.

It includes several new features, including that people can be dropped from the program after two years without “criminal activity” and a phone number they can call with questions.

In an online video, Sheriff’s Office Captain Toni Roach says being selected is “good news” because participants will “have the opportunity to receive assistance from the Pasco Sheriff’s Office and several community partners.”

But critics of the agency’s intelligence efforts, including an alliance of local, state and national organizations known as People Against the Surveillance of Children and Overpolicing, or the PASCO Coalition, said the latest communication raises even more concerns.

“The letter is basically threatening and promising a certain level of harassment and oversight that is in line with the stories we are hearing from the community,” said Raniah Elgendi, of the Council of American-Islamic Relations-Florida.

“We know that is not what makes people or communities more safe, this heightened level of surveillance,” said Lauren Johnson, an assistant counsel at the NAACP Legal Defense Fund.

The Times found being named a Sheriff’s Office target could have serious consequences. Deputies showed up at homes at all hours of the day and night, writing tickets for violations like overgrown grass and making arrests for any reason they could find.

By 2020, some 1,000 people had been ensnared. About 100 were 18 years old or younger.

The new letter to so-called “prolific offenders” says its purpose is to communicate the agency’s “sincere desire” to help recipients “begin a new path.”

“We are committed to your success,” it says.

The letter notes that the Sheriff’s Office has partnered with Pasco County Human Services and provides contact information for 18 government agencies, health clinics and non-profit organizations.

But it also delivers a stern warning: “Our desire to help you will not hinder us from holding you fully accountable for your choices and actions.”

It then says the Sheriff’s Office will share recipients’ names and criminal histories with local, state and federal law enforcement agencies to ensure “the highest level of accountability” for any future crimes they commit.

Members of the PASCO Coalition questioned whether the Sheriff’s Office pressuring people to get services would actually help.

They also took issue with the language used in the letter.

“It is so incredibly patronizing and offensive on so many levels,” said Bacardi Jackson, Florida Managing Attorney at the Southern Poverty Law Center.

The coalition is continuing to demand changes to Pasco’s intelligence programs, its members said.

Times Staff Writer Kathryn Varn contributed to this report.",Pasco Sheriff’s Office letter targets residents for ‘increased accountability’,https://www.tampabay.com/investigations/2021/07/24/pasco-sheriffs-office-letter-targets-residents-for-increased-accountability/
"[""Matthew Guariglia""]",2021-07-27,2021-07-27,2021-03-22,2021-07-27,https://www.eff.org/files/2021/03/22/pasco_1.png,2015-09-01,0,en,,www.eff.org,"[""Kate Perkins""]","The group asked the Department of Education to look at children of color, racial disparities in its federal investigation.

In September 2020, the Tampa Bay Times revealed a destructive “data-driven” policing program run by the Pasco County, Florida Sheriff's Office. The program is misleadingly called “Intelligence-Led Policing” (ILP), but in reality, it's nothing more than targeted child harassment by police. Young people's school grades and absences, minor infractions, and even instances where they are a victim of crime are used to inform a bogus rubric and point system, based on a formula that intends to ""prevent future crimes""—essentially labeling youths as a potential future criminals.

Below is a page from the ILP’s pseudoscientific manual. Once a juvenile is tagged with this label, police show up at their home and harass their entire family. As one former deputy described the program to reporters, the objective was to “make their lives miserable until they move or sue.”

The fault lies not just with the Pasco County Sheriff’s Office, which built this system and uses it to hound youth. The system also functions with the help of public schools and child welfare agencies that collect data about kids for purposes of providing them with important educational and social services, and then hand this data over to the Sheriff. This is an egregious abuse of trust. As a reaction to this publicized relationship between the schools and the police, the Charles and Lynn Schusterman Family Philanthropies organization cut nearly in half the money it had intended to give Pasco County schools, pulling the remaining $1.7 million. The organization explained, reasonably, that the program was contradictory to their values. 

It’s not hard to see why an organization would pull grant funding. The program, as well as many other data-driven or predictive policing models, creates a self-fulfilling feedback loop from which it is nearly impossible for a child or their family to escape. Anyone, when put under a microscope by police, might accumulate citations, fines, and even arrests. And that’s what this program does: it takes families, often ones that are already struggling, and puts them under the aggressive eye of police who expect their lives to become even more miserable. 

Some of the stories that emerged from news reporting illustrate the harms that getting stuck in an enforcement loop can have on people. After one 15-year-old was arrested for stealing bicycles out of a garage, the algorithm continuously dispatched police to harass him and his family. Over the span of five months, police went to his home 21 times. They also showed up at his gym and his parent’s place of work. The Tampa Bay Times revealed that since 2015, the sheriff's office has made more than 12,500 similar preemptive visits to people. 

These visits often resulted in other, unrelated fines and arrests that further victimized families and added to the likelihood that they would be visited and harassed again. In one incident, the mother of a targeted teenager was issued a $2,500 fine for having chickens in the backyard. In another incident, a father was arrested because his 17-year-old was smoking a cigarette. These behaviors occur in all neighborhoods, across all economic strata—but only marginalized people, who live under near constant police scrutiny, face penalization.

The Sheriff’s Office and the school district have claimed that the program is intended to identify at-risk youth in need of state intervention or mentorship. But in at least five places in the Sheriff’s ILP manual (including the one below), the program’s actual stated purpose is to identify potential future offenders. 

The ILP manual lists characteristics that the program considers as so-called “criminogenic risk factors”; these are the factors unscientifically believed to lead to future criminality. The characteristics include being a victim of a crime, unspecified “low intelligence,” “antisocial parents,” and being “socio-economically deprived.” The ILP manual explains the program’s purpose is to identify youth “destined to a life of crime.” 

This is absurd. No one is destined to a life of crime. Having bad grades or economic struggles does not make a person into a criminal suspect, or make them deserving of police harassment. 

In response to the program, a number of civil liberties groups have stepped up to try to stop the data sharing between the school district and the police, and end the ILP program. Color of Change launched a petition allowing people to tell the Superintendent of schools to stop sharing data with the police. The Institute for Justice also launched a lawsuit against the Sheriff's Office, asserting the First, Fourth, and Fourteenth Amendment rights of those that have been victimized by the program. We anticipate more advocacy to come against this program. 

In response to recent news about the program, Florida Republican Congressmember Matt Gaetz called on Governor DeSantis to remove the sheriff, Chris Nocco, from his post. 

Florida state senator Audrey Gibson has also introduced SB 808, which seeks to place a few limits on this kind of Intelligence-Led Policing. Most importantly, it would require notice to a person that they are listed and an opportunity to appeal that listing. The bill would also require departments that use these programs to adopt guidelines to address data processing, program goals, and number and length of visits. Further, the bill would mandate documentation of visits, including audio and video (presumably from police body worn cameras), and records on the demographics of visited youths.  Although this bill may mitigate some of the program’s more egregious potential abuses, it’s not nearly enough to prevent all of the harms ILP generates. Predictive policing programs that rob people of their presumption of innocence, and open them up to harassment and surveillance, should be banned. 

EFF has been an outspoken critic of police use of gang databases, which often have subjective and racist criteria for inclusion and which open up an individual to unfair police harassment and surveillance. Once put on the list, people often can be harassed for years without any knowledge of how to get remove themselves. Such opaque conditions exist in Pasco County as well. 

EFF is working with a coalition of local, statewide, and national organizations that are trying to dismantle this harmful ILP program. Attempts to predict crime and sniff out future criminals are not new; they’ve been fodder for science fiction writers, criminologists, and detectives for over a century. But then and now, no one cannot predict crime, they can only create targets through excessive surveillance. “Data” and “intelligence” too often are buzzwords that imply a police initiative is objective and immune from human biases. But when fallible and biased individuals, including school administrators and police, determine who is and is not a future criminal based on exam grades or supposedly “antisocial” behavior, the “intelligence” system will only serve to replicate pre-existing racial and class hierarchies. ",Pasco County’s Sheriff Must End Its Targeted Child Harassment Program,https://www.eff.org/deeplinks/2021/03/pasco-countys-sheriff-must-end-its-targeted-child-harassment-program
"[""Todd Feathers""]",2021-08-17,2021-08-17,2021-07-19,2021-08-17,https://video-images.vice.com/articles/60f1b788daac5e0094c30815/lede/1626704180119-gettyimages-1257497678.jpeg?image-resize-opts=Y3JvcD0xeHc6MC44NDI1eGg7MHh3LDB4aCZyZXNpemU9MTIwMDoqJnJlc2l6ZT0xMjAwOio,2016-04-01,0,en,,www.vice.com,"[""Kate Perkins""]","The right angle formed by Belmont and North Central Park avenues forms an invisible borderline in Chicago. 

To the south and east, the residents are primarily Black and brown. To the north and west, the neighborhoods are almost all majority white.

The two avenues mark another stark separation that follows the lines of racial segregation throughout Chicago: In nearly every community of color in the city, the Chicago Police Department (CPD) has installed ShotSpotter , a system that uses hidden microphone sensors to detect the sound of gunshots, generate real-time alerts, and trigger armed police responses to the location. In most of the white neighborhoods, there are no sensors at all, according to Motherboard’s analysis of ShotSpotter data obtained through a public records request.

Chicago is not alone. Cities and police departments are loath to disclose the locations of their ShotSpotter sensors, but through public records requests Motherboard also obtained years of data from Kansas City, Missouri; Cleveland, Ohio; and Atlanta, Georgia showing where ShotSpotter sensors generated alerts—a proxy for the general location of the sensors. 

In all four cities, the data shows that the sensors are also placed almost exclusively in majority Black and brown neighborhoods, based on population data from the U.S. Census.

In Chicago, the technology's reliability is coming under increasing scrutiny. Community members and civil rights activists say false ShotSpotter alerts bring a flood of unnecessary police into their neighborhoods, and even accurate alerts can create dangerous situations. In March, one such alert initiated a police response that eventually led to the killing of 13-year-old Adam Toledo, who was unarmed when Chicago police shot him. 

“The system is telling police that every time they go out in response to a ShotSpotter alert they should assume that anybody in the vicinity is armed and they’ve just fired a weapon,” Jonathan Manes, an attorney with the MacArthur Justice Center at the Northwestern Pritzker School of Law who has studied ShotSpotter in the city, told Motherboard. “The system is telling police officers that anybody in the area is a mortal threat. Following up on those alerts is creating a dangerous situation, and it’s happening 61 times a day in the city of Chicago.”

The Chicago Police Department, Mayor Lori Lightfoot’s office, and Alderman Chris Taliaferro, who chairs the city council’s public safety committee, did not respond to interview requests or questions.

“In general, police department customers determine coverage areas with assistance from ShotSpotter by analyzing historical gunfire and homicide data to assess areas most in need of gunshot detection,” Sam Klepper, senior vice president for marketing and product strategy at ShotSpotter, wrote to Motherboard in response to questions.

“We believe all residents that live in communities experiencing persistent gunfire deserve a rapid police response that gunshot detection enables, regardless of race or geographic location,” the company added. “While gun violence can unfortunately happen anywhere at any time, cities lack sufficient funds to cover an entire city with gunshot detection technology, so they most commonly deploy sensors in neighborhoods with the highest levels of gun violence to make the greatest impact.""

Kansas City, MO

In 2012, the Kansas City Area Transportation Authority received a federal grant to expand one of its express bus lines. Some of those funds were used to install ShotSpotter, in cooperation with police, in locations that “provided the highest amount of coverage to the areas most densely and heavily traveled by the public transit lines,” the Kansas City Police Department Sergeant Jake Becchina told Motherboard in an email.

What that meant in practice is that ShotSpotter sensors were installed in a 3.5-square mile swath—about 1 percent of the city’s footprint—that primarily includes neighborhoods where white residents make up as little as 3.5 percent of the population, according to Census data.

“We would love to have the resources to blanket the entire city with gunshot detection,” Becchina wrote to Motherboard. “ShotSpotter alerts give our officers more detailed information about what’s happening than with 911 calls alone ... so they are better able to bring a dangerous situation safely under control more quickly and efficiently.”

He added that 70 percent of the time ShotSpotter generates an alert, nobody calls 911 to report gunshots, according to an analysis performed in 2016.

That could be because residents choose not to call 911, or because no gunfire actually occurred and ShotSpotter misidentified a sound, as some studies suggest the technology does quite frequently.

“I think I speak for a lot of people when I say [ShotSpotter is] not welcome technology,” Henry Service, a Kansas City lawyer and community activist, told Motherboard. “We don’t want to be treated like a surveilled community, a community that’s under siege. The kind of policing we want is the kind of policing you get in the suburbs or affluent communities.”

As in many cities that have installed ShotSpotter, the initial deployment in Kansas City covered a small geographic area and was funded by a grant. ShotSpotter costs between $65,000 and $95,000 per square mile annually, plus installation costs, making it a prodigious investment.

Kansas City officials have said at various times since 2012 that they want to expand ShotSpotter to cover more of the city, potentially even more affluent sections, but so far, that hasn’t happened.

Atlanta, GA

The Atlanta Police Department (APD) installed 100 sensors in the city in 2018, funded entirely by grants from the Atlanta Police Foundation and Georgia Power, a utility company. The city stopped using the sensors in 2020, when funding ran out.

When local media first reported the ShotSpotter program, APD would not disclose the exact location of the sensors but said they would initially be located only in several West Atlanta neighborhoods, which happen to be overwhelmingly non-white. Alerts in the map below in the city’s outer neighborhoods may be the result of errors in the data. APD did not respond to a request for comment.

Unlike the ShotSpotter data Motherboard obtained from other cities, the Atlanta data also includes fields for when officers arrived at the scene of an alert and when they departed. The system generated 2,925 shots-fired alerts during its time in use. The median amount of time APD officers spent on scene for those alerts was nine minutes, suggesting that in a large proportion of the cases officers found little to work with at the scenes to which ShotSpotter dispatched them.

Cleveland, OH

Cleveland is one of the newest cities to have installed ShotSpotter, beginning its program in November 2020. The system—funded entirely during its two-year pilot phase by a $375,000 grant from the Cleveland Police Foundation—has been deployed in a small section of Southeast Cleveland that city officials have described as a high-crime area.

Those neighborhoods also happen to be among the least white in the city and those hit hardest by economic recession and the pandemic, according to local community organizers.

“These are communities that lack resources and have been targeted by city officials because they claim that they are highly concentrated areas of violence,” LaTonya Goldsby, president of Black Lives Matter Cleveland, told Motherboard. “You can see the disenfranchisement. There has been no reinvestment within that side of town. I would say it’s been a continued depletion of resources.”

The Cleveland Division of Police selected the Shotspotter locations by analyzing three years of crime data within its police district four, which encompasses many of the Blackest, most impoverished parts of the city. The area the division chose for Shotspotter accounted for 37 percent of all shots fired calls, 37 percent of felonious assaults, and 45% of all homicides within district four, Sergeant Jennifer Ciaccia wrote to Motherboard in an email.

“The technology appears to be extremely accurate, allowing officers to respond to locations of gunfire based on technology instead of community calls which can be more subjective,” she wrote.

Cleveland’s mayor and several city councilors did not respond to requests for comment.

After the Cleveland City Council—which has not allowed public input at its meetings since the 1930s—approved the ShotSpotter plans, Cleveland activists including Mary Drummer, a campaign director for AI for the People, wrote to councilors to ask that the money allocated for ShotSpotter be put to other uses in the affected communities.

“There’s worry that It’s going to lead to police harassment of folks that are just minding their business,” Drummer told Motherboard. “It’s really interesting, especially after the pandemic, how there’s never enough money to fund the community and get them the services they need, but there’s always enough money for the police.”",Gunshot-Detecting Tech Is Summoning Armed Police to Black Neighborhoods,https://www.vice.com/en/article/88nd3z/gunshot-detecting-tech-is-summoning-armed-police-to-black-neighborhoods
