authors,date_downloaded,date_modified,date_published,date_submitted,image_url,incident_date,incident_id,language,mongodb_id,source_domain,submitters,text,title,url
"[""Ryan Francis""]",2020-10-30,2020-10-30,2017-05-03,2020-10-30,,2013-11-27,0,en,,www.csoonline.com,"[""Ingrid Dickinson (CSET)""]","""It is commonly referred to as information overload. An infosec professional throws out a wide net in hopes of stopping malware before it gets too deep into the network, but like a motion-sensor light, sometimes the alert catches a squirrel instead of a burglar.

Rob Kerr, chief technology officer at Haystax Technology, cited the 2013 breach at Target, as an example in which thieves stole some 40 million Target credit cards by accessing data on point of sale (POS) systems. Target later revised that number to include theft of private data for 70 million customers.

“There were many missteps before the breach happened, but a big one was that Target missed internal alerts -- only finding out about the breach when they were contacted by the Department of Justice,” he said.

Kerr said there were two different issues relating to the alert problem: While the attack was in progress, monitoring software (FireEye) alerted staff in Bangalore, India, who in turn notified Target staff in Minneapolis. No action was taken because these alerts were included with many other likely false alerts. Kerr recalls that it also appeared that at least some of the company's network infiltration alerting systems were turned off to reduce false positives.


A survey by FireEye polled C-level security executives at large enterprises worldwide and found that 37 percent of respondents receive more than 10,000 alerts each month. Of those alerts, 52 percent were false positives, and 64 percent were redundant alerts.

“This represents a huge burden on companies, as around 40 percent of them manually review each alert,” Kerr said.

In most enterprises, various monitoring and detection solutions are constantly combing through network and user activity data looking for anomalies that may indicate a malicious event is taking place. Each time the system gets a hit, an alert is generated that typically requires a human analyst to either verify it is a bona-fide threat, or clear as not applicable or too minor.





The problem this creates is analyst overload, Kerr notes. “In other words, the system is unable to provide sufficient context up front to filter out the anomaly before it generates an alert, so it falls to the analyst to do that manually. This is a big problem because there are thousands of pieces of data on network logins, printer activity and building access logs. So there will be an alert when Bob -- who typically works 9 to 5 every day -- reenters the office at 7:30 one evening and prints a large file on a Sunday, accessing a file server that is normally off-limits to him.” 






The Cisco 2017 Security Capabilities Benchmark Study found that, due to various constraints, organizations can investigate only 56 percent of the security alerts they receive on a given day. Half of the investigated alerts (28 percent) are deemed legitimate; less than half (46 percent) of legitimate alerts are remediated. In addition, 44 percent of security operations managers see more than 5000 security alerts per day.

Kerr added that the combination of filtering out minor activity and highlighting the highest-priority risks has the net effect of providing enough context to drastically diminish false positives and the burdens they place on overworked analyst teams.

One of the key takeaways from a recent Rapid7 report was that reducing alert fatigue should always be a goal, but there’s more to it. A better signal-to-noise ratio means responders and analysts are more likely to see meaningful trends. One trend is that attackers still heavily rely on user interaction. For instance, on Monday holidays, alerts dipped significantly, which Rapid7's analysts attributed to a lack of employees interacting with malicious emails, attachments, etc.

Rapid 7’s report also notes that if you design indicators based only on currently available information, rather than seeking out additional intelligence or adding industry- and company-specific context, the result will be low-quality alerts. In other words: while most alerts are triggered from known, malicious activity, the quality of these alerts is entirely dependent on the established indicators.


As the entire process shifts, this is how to address remote learning — quickly

Rebekah Brown, intelligence lead at Rapid7, said it is difficult to compile a list of common alerts that will be good for everyone, all the time. “Even some that seem like obvious choices--i.e., alerting on hashes associated with ransomware--may not be universally applicable. For example, if they are hashes that encrypt Windows-based systems, they wouldn’t be relevant in an organization that only uses Macs,” she said.

She added that a customer needs to identify what threats are relevant to them because of the systems they use, the data they have, and their threat profile. For example, a retail company that deals with both online and in-store sales would want to alert on:

Threats to their e-commerce platform, which can come from a threat feed that gathers data on brute force and other attacks against that specific platform
Threats to POS systems 
Threats reported by an industry-specific information sharing group, such as the R-CISC
General threats to Windows systems including ransomware, credential theft or malware 
Custom alerts based on things that they have seen in their environment before
Brown said there are three primary sources for detections: threat feeds (primarily from honeypots and network sensors), threat reports (primarily from IR investigations or research initiatives), and internal detections (from previous incidents).

Staple lists Brown likes to use include Facebook threat exchange, Openbl_1d (open blocklist 1 day), Ransomware_feed by Abuse.ch and SSL blacklist by Abuse.ch.

Common mistakes
Kerr shared common security analytics mistakes that trigger false positives. They are as follows: 

1. More alerts than you can process. Security analytics systems present a challenge for security organizations. They can alert on just about any event, and most of the time those alerts are for benign events. The natural response is to turn off the noisiest offenders. Turn off too many and you can miss events that are important. Good security analytics tools use context to give you the best of both worlds -- fewer, higher quality alerts.

2. Only alerting for things that are happening right now. Security analytics systems are most often configured to alert when something obviously malicious is occurring. But waiting until you see malicious activity puts your security team into response mode before they even start. Good security analytics tools are like spotlights and let you see negative behavior before it starts so you can take proactive action to stop it.

3. Only looking at network data. Security analytics systems are often configured to only see network data. This data is readily available, and connecting it to your system is generally painless. However, many potentially malicious network events are more likely benign events that triggered your security analytics system. Additional information is essential to clear the alerts and your security team spends its time gathering data to clear alerts. Good security analytics tools integrate with other internal and external data sources to eliminate specious alerts based on context.

4. Not prioritizing alerts. Time is our most precious commodity. Security analytics systems that don't effectively prioritize alerts waste your team's time by asking them to clear low-value alerts when highly important alerts linger at the bottom of their queue. Good security analytics systems drive your team to the events that most need attention via strong prioritization.

5. Alerts without context. When your security team processes an alert, the first thing they will do is look for additional information that provides the context they need to clear it. They will use a variety of on and off network tools to evaluate the alert and take the appropriate action. Good security analytics tools will assist that workflow by integrating with other internal and external data sources to minimize false alerts and prioritize real alerts more effectively.

Setting up good alerts
Brown said companies should look for reports that are specific to your industry, sector, or geographic region. Reports are better at this than feeds. Here are a few she recommends.

US-CERT reports usually contain at least some contextual information, along with network based indicators that can be used to build detections for network traffic (primarily c2 nodes--if you see this then you already have malware on your system) as well as host-based detections, which are usually malware hashes or file names. These can be blocked or monitored for. If they are blocked you should still have a way to check those alerts, it is important to see who has attempted to attack you. 

DHS/FBI and other .gov reports are often not as timely as one would hope, but if the government is taking the time to put something out, it is worth your time to read. Look for the timing on when the attack/data was from. Most of the time with these reports it is good to look back in time for indicators rather than setting up alerts. By the time the government has put something out the attackers have likely changed infrastructure or moved onto a new evolution of malware samples. 

Commercial threat reports are often more timely than government reports, though they are also usually coming at the tail end of an investigation, so it may not be worth setting up alerts looking for future activity, especially when it comes to network-based indicators like IP addresses and domains that are often not active for long. Instead, look for attacker activities or behaviors to build detections – for example, did an attacker use a phishing email to get an attacker to download a file, which then launched an executable (like we saw with the recent exploitation of CVE-2017-1099)? In that case, blocking or alerting on executables launched from word documents would be a good detection. The more a detection can look for an attacker behavior rather than just a discreet indicator associated with a piece of malware the more effective that detection will be.

Researcher blogs are some of the best sources of intelligence on threats. They are usually timely and have good technical information, though they don’t always provide higher level details such as which industries are targeted or what the impact of an attack would be. Still, they are some of the best places to get information on how attacks are being carried out.

“When building detections from blogs, I look for what can be alerted on (IPs, domains, hashes or behaviors such as where a malware sample executes), the timing and what the threat is related to. When you have these pieces you can understand what the threat is and what to do if you see something alert,” Brown said.

Rapid 7’s threat report also found that attacks increase in volume during the afternoon and evening hours. This may correlate to when most users are active, but regardless, analysts should be aware of the hours of the day when the highest volume of threats are generated.

The report also showed that most alerts come from known, bad activity, like multiple concurrent logins or malware. However, data showed a large increase in custom alerts relevant to only some organizations. This can be helpful for tracking new threats, but can also be misleading. When there are high volumes of alerts generated from a single rule in a short time period, it either means that you have a big problem with your network, or you have a big problem with the custom alert.

■ RELATED: Threat intelligence overload
Rapid 7 said attackers will always be faster, but understanding the threat landscape will go a long way toward shortening the time to respond and remediate critical issues. Knowing when you need to act fast and when to stick with a slow and steady (and reliable) remediation plan is the key.""",False positives still cause threat alert fatigue,"https://www.csoonline.com/article/3191379/false-positives-still-cause-alert-fatigue.html#:~:text=Rob%20Kerr%2C%20chief%20technology%20officer,data%20for%2070%20million%20customers."
"[""Anand Tamboli""]",2020-10-30,2020-10-30,2020-09-11,2020-10-30,,2018-02-01,0,en,,medium.com,"[""Ingrid Dickinson (CSET)""]","""In early 2018, an Australian telecommunications company bit the bullet and rolled out an AI program for its incident management process. The telco expected to save more than 25% of the operational costs from this implementation. Unfortunately, the plan backfired.
The bot was designed to intercept all of the network incidents, 100% of them. Once intercepted, it would follow a series of checks based on the problem as reported by the users. It was programmed to take one of the three pre-defined actions based on the tests it would perform.
Firstly, it would remotely resolve the incident by fixing the issue programmatically. If that did not work, it would assume that a technician’s visit is required to customer premises. Accordingly, it would issue a work order to send someone directly. If none of that were apparent, it would present the case to the human operator for further investigation and decision.
At the outset, this approach was seemingly sound and appeared quite logical. Within a few weeks, after the rollout company realized, the bot was sending an awful lot of technicians in the field. Of course, sending out technicians for the field visit was a costly affair, and it was always the last choice for fixing an issue. The bot, however, maximized on that choice.
Later, the team found out that there were a few incident scenarios only a human operator could understand (and invariably join the dots). Apparently, for the bot, they were not clear enough. In all such cases, a human operator would have taken a different decision than the bot.
Now, here was the kicker. Despite finding out the flaw in logic, the automation team was unable to turn off the bot (much like what Microsoft did with Tay in 2016). They had implemented the bot in all or nothing fashion, and it was sitting right in the middle of the user and operator interface. Which meant there were only two possibilities. Either all the incidents would go through the bot and get incorrectly handled more often. Or none of them would go through the bot and thereby getting handled manually.
But the telco was not ready to handle such a workload — they had already released the staff for saving costs (oops!).
Eventually, the telco set up another project to fix the bot while it was in operation and wasted several million dollars in the process.
They spent the money on two things, for continuing the service with an artificially stupid bot, and for running a massive fix-up project that lasted for more than a year.
Eventually, the endowment effect kicked in, and the company had no plans to go back and fix the problem from its roots. Instead, it kept pushing through and wasting an enormous amount of money, allegedly circa $11 million in operational costs.
The crucial question remains — who eventually paid for this?
Every link that joins two heterogeneous systems is a weak link!
I saw this fiasco up close and personal. In my view, this implementation went wrong on several levels, right from system design to its implementation and fixing of the problems.
But the first and foremost question is: why there was no plan B, a kill switch of some sort to stop this bot. The bot development and rollout were not thoroughly tested for all the potential scenarios and thus lacked testing rigor that could have identified problems early on. While the time required to fix the situation was too long, detecting the failure of bot took considerably longer.
This story (or case study, as some would call it) highlights many weak spots in AI and its development. It guides us to focus on specific risks. It may be merely a drop in the ocean, but an accurate representation of a few common aspects.
What went wrong?
A few things in the above story failed, and it is not the technology!
Creators of AI and the business that deployed it have not been careful enough. They did not follow the fundamental tenet of handling something as powerful as AI, responsibly.
We often say, “With great power comes great responsibility.” And yet, in this case, responsible design or deployment did not occur in full spirit.
Responsible behavior is necessary for the deployment and use of AI as well as all other stages from conception to design, testing to implementation, and ongoing management and governance.
There is also a level of weakness in the solution conception stage, which directly seeped into their development.
Emphasis on solution quality was not enough. There might have been a few testing routines. Just enough to meet the requirements of IT development frameworks, but not enough to meet the AI development framework — which does not exist!
Creators lacked thoughtfulness in the design of the solution.
Three things you should learn from this
If you are planning to implement an AI solution, or in the midst of it, then you must learn from this fiasco. It will not only save your money and resources but also give you peace of mind in the long run.
1. Rigorous testing is of utmost importance: Firstly, you must understand that narrow AI is all about the relation between input and outputs. You provide input X and get output Y, or there is input X to do output Y. Either way, the nature of input affects the output. Indiscriminate input can lead to adverse outcomes. And this is just one good reason why rigorous testing is so important. We must note that in the case of AI systems, general IT system testing mechanisms are usually not enough.
2. Always keep humans in the loop: When discretion and exceptions are required, use automated systems only as a tool to assist humans — or do not use them at all. There are still several applications and use cases that we cannot define as clearly as a game of chess. The majority of the AI systems are still kids, and they need a responsible adult to be in charge. Most importantly, ensuring enough human resources are available to handle the likely workload is always a good idea.
3. Good governance and risk management are critical: As AI systems become more powerful, managing risk is going to be even more critical. Having robust governance in place is not only an umbrella requirement for the industry but also is a good idea for every business to have in-house.
You do not always need to lose millions or face challenges to learn. When you see a failure, do not fail to learn the lesson!""",A Lesson Worth $11 Million,https://medium.com/tomorrow-plus-plus/a-lesson-worth-11-million-7851be19921f
"[""Paul Mozur"","" Raymond Zhong"","" Aaron Krolik""]",2020-11-25,2020-11-25,2020-03-01,2020-11-25,https://static01.nyt.com/images/2020/02/29/business/29china-surveillance-1/29china-surveillance-1-superJumbo.jpg?quality=90&auto=webp,2020-02-15,0,en,,www.nytimes.com,"[""Chang Liu""]","Leon Lei, 29, signed up for an Alipay code before leaving his hometown, Anqing, to return to work in Hangzhou. At first, his code was green. But a day before he departed, it turned red, and he didn’t know why. Anqing has not been especially hard hit by the virus, though it neighbors Hubei Province, the center of the outbreak.

On the road to Hangzhou, officers at two highway exits saw his digital scarlet letter and stopped him from taking the exit. Only at a third exit was he allowed to pass.

“The broad rules aren’t public,” Mr. Lei said. “How it assigns red or yellow codes isn’t public. And there’s no clear way to make your code turn green.”

Both Alibaba and Ant Financial have their headquarters in Hangzhou, and as the system expands nationwide, other places may not enforce it as stringently. According to the Xinhua news agency, 100 Chinese cities were using the system within a week of its introduction in Hangzhou on Feb. 11.

Complaints began flooding social media almost as quickly.

Vanessa Wong, 25, works in Hangzhou but has been stuck for weeks in her hometown in Hubei Province. She has no symptoms. But her health code is red, and both her employer and her housing complex in Hangzhou require people to have a green code to be allowed back.

So far, she has heard nothing from the authorities about when she might expect her code to change color. Her best guess is that it’s red simply because she is in Hubei.

Hangzhou officials have acknowledged the unease the system has caused. At a recent news conference, they urged citizens to report glitches and inaccuracies to the authorities.

“Even if a yellow code or a red code appears, don’t be nervous,” said Tu Dongshan, the deputy secretary-general of the city’s Communist Party committee.

Holed up at home and unable to concentrate on her work, Ms. Wong is feeling helpless. She cannot help noticing that the system encourages a kind of regional prejudice.

“It divides people up based on where they’re from,” she said. “Isn’t that discrimination?”

With fear of the virus still acute, many in China take comfort in high-tech precautions, even if they are at times impractical and dysfunctional. Doo Wang, 26, said her code was red for a day before it inexplicably changed to green. Calling a support hotline yielded no answers. Yet she still approves of the system.

“If we had to use it indefinitely, that would be crazy — just way too big a pain,” Ms. Wang said. “But for the epidemic, it makes sense.”",China's Health Code misjudge citizen's COVID-19 exposure risk,"https://www.nytimes.com/2020/03/01/business/china-coronavirus-surveillance.html#:~:text=A%20green%20code%20enables%20its,means%20a%20two%2Dweek%20quarantine."
